"Rank","NCT Number","Title","Acronym","Status","Study Results","Conditions","Interventions","Outcome Measures","Sponsor/Collaborators","Gender","Age","Phases","Enrollment","Funded Bys","Study Type","Study Designs","Other IDs","Start Date","Primary Completion Date","Completion Date","First Posted","Results First Posted","Last Update Posted","Locations","Study Documents","URL"
5,"NCT03469960","Double Immune Checkpoint Inhibitors in PD-L1-positive Stage IV Non-small Lung CancEr","DICIPLE","Recruiting","No Results Available","Non-Small Cell Lung Cancer Metastatic","Drug: Ipilimumab|Drug: Nivolumab","Progression Free Survival (PFS1)|Progression Free Survival (PFS2)|Quality of life|Overall survival (OS)|Biological correlative exploratory studies (PD-L1)|Biological correlative exploratory studies (PD-L1 H score)|Biological correlative exploratory studies (CD3/CD8)|Biological correlative exploratory studies (neutrophil)|Biological correlative exploratory studies (cytokines)|Biological correlative exploratory studies (chemokines)","Intergroupe Francophone de Cancerologie Thoracique","All","18 Years to 75 Years   (Adult, Older Adult)","Phase 3","1360","Other","Interventional","Allocation: Randomized|Intervention Model: Parallel Assignment|Masking: None (Open Label)|Primary Purpose: Treatment","IFCT-1701|2017-002540-33","May 2, 2018","May 2023","May 2023","March 19, 2018",,"September 4, 2019","Amiens - CHU, Amiens, France|Angers - CHU, Angers, France|Annecy - CH, Annecy, France|Argenteuil -CH, Argenteuil, France|Avignon - CH, Avignon, France|Bordeaux - Polyclinique Nord, Bordeaux, France|Boulogne - Ambroise Paré, Boulogne-Billancourt, France|Caen - CHU Côte de Nacre, Caen, France|Cahors - CH, Cahors, France|CH de Pontoise, Cergy Pontoise, France|CH Chambery, Chambery, France|CH de Chauny, Chauny, France|CH, Cholet, France|Clamart - Hôpital Percy, Clamart, France|Clermont Ferrand - CHU, Clermont Ferrand, France|Colmar - CH, Colmar, France|Dijon - CAC, Dijon, France|CHRU Grenoble, Grenoble, France|La Roche Sur Yon - CH, La Roche Sur Yon, France|Centre Hospitalier - Pneumologie, Le Mans, France|CHRU de Lille, Lille, France|CHU de Limoges, Limoges, France|CH Lyon Sud - Pneumologie, Lyon, France|Institut Paoli Calmette, Marseille, France|Marseille - Hôpital Européen, Marseille, France|Mont de Marsan - CH, Mont de Marsan, France|Mulhouse - CH, Mulhouse, France|Nantes - Centre René Gauducheau, Nantes, France|Centre Antoine Lacassagne, Nice, France|CHU Nîmes, Nîmes, France|Orléans - CH, Orléans, France|AP-HP Hopital Tenon - Pneumologie, Paris, France|AP-HP Hôpital Bichat, Paris, France|GH Paris Saint-Joseph, Paris, France|Hôpital Saint Louis APHP, Paris, France|Paris - Institut Curie, Paris, France|Rouen - CHU, Rouen, France|Saint Quentin - CH, Saint Quentin, France|Centre René Huguenin, Saint-Cloud, France|HIA Begin, Saint-Mandé, France|ICL Lucien Neuwirth, Saint-Priest-en-Jarez, France|Suresnes - Hopital Foch, Suresnes, France|Toulon - CHI, Toulon, France|CHU Toulouse, Toulouse, France|CHRU de Tours, Tours, France|Versailles - CH, Versailles, France|CH de Villefranche - Pneumologie, Villefranche, France",,"https://ClinicalTrials.gov/show/NCT03469960"
6,"NCT04157985","Evaluation of the Length of Treatment With PD-1/PD-L1 Inhibitors in Patients With Advanced Solid Tumors",,"Recruiting","No Results Available","Advanced Solid Tumors|NSCLC|Bladder Cancer|HNSCC|Renal Cancer|Melanoma|Anal Cancer|Colorectal Cancer|Cholangiocarcinoma|Gastric Cancer|Hepatocellular Carcinoma","Drug: Continue PD-1/PD-L1 Inhibitors treatment|Other: Discontinue PD-1/PD-L1-1 inhibitor","Time to next treatment|Incidence of irAEs (Immune-Related Adverse Events)|Overall Survival (OS)|Best Objective Response (BOR)","Antoinette J Wozniak|University of Pittsburgh","All","18 Years and older   (Adult, Older Adult)","Phase 3","578","Other","Interventional","Allocation: Randomized|Intervention Model: Parallel Assignment|Masking: None (Open Label)|Primary Purpose: Treatment","19-135","November 15, 2019","October 31, 2021","October 31, 2021","November 8, 2019",,"December 4, 2019","UPMC Hillman Cancer Center, Pittsburgh, Pennsylvania, United States",,"https://ClinicalTrials.gov/show/NCT04157985"
7,"NCT04338269","A Study of Atezolizumab in Combination With Cabozantinib Compared to Cabozantinib Alone in Participants With Advanced Renal Cell Carcinoma After Immune Checkpoint Inhibitor Treatment","CONTACT-03","Not yet recruiting","No Results Available","Carcinoma, Renal Cell","Drug: Atezolizumab|Drug: Cabozantinib","Progression-Free Survival (PFS), as assessed by Independent Review Facility (IRF)|Overall survival (OS)|PFS Assessed by the Investigators (INV-PFS)|Investigator Assessed Objective Response Rate (INV-ORR)|IRF Assessed Objective Response Rate (IRF-ORR)|Investigator Assessed Duration of Objective Response (INV-DOR)|IRF Assessed DOR (IRF-DOR)|Percentage of Participants With Adverse Events|Atezolizumab Concentrations|Cabozantinib Concentrations|Percentage of Participants With Anti-Drug Antibodies (ADAs) to Atezolizumab|Number of ADAs to Atezolizumab","Hoffmann-La Roche","All","18 Years and older   (Adult, Older Adult)","Phase 3","500","Industry","Interventional","Allocation: Randomized|Intervention Model: Parallel Assignment|Masking: None (Open Label)|Primary Purpose: Treatment","WO41994","July 31, 2020","December 31, 2022","November 29, 2024","April 8, 2020",,"April 8, 2020","Zeisigwaldkliniken Bethanien, Chemnitz, Germany|Klinikum der Johann Wolfgang Goethe-Universitaet; Urologie und Kinderurologie, Frankfurt, Germany|Universitaetsklinikum Freiburg; Urology, Freiburg, Germany|Krankenhaus Martha-Maria Halle-Dölau, Klinik für Urologie, Halle (Saale), Germany|Uniklinik-Eppendorf; Klinik U Poliklinik F Urologie, Hamburg, Germany|Medizinische Hochschule Hannover; Klinik für Urologie und Onkologische Urologie, Hannover, Germany|Universitaetsklinikum Muenster; Urology, Muenster, Germany|Klinikum rechts der Isar der TU München; Urologische Klinik und Poliklinik, München, Germany|Universitätsklinikum Tübingen; Klinik für Urologie, Tübingen, Germany|Universitätsklinikum Ulm; Klinik für Urologie, Ulm, Germany|Chungnam National University Hospital, Daejeon, Korea, Republic of|National Cancer Center, Gyeonggi-do, Korea, Republic of|CHA Bundang Medical Center, Gyeonggi-do, Korea, Republic of|Seoul National University Bundang Hospital, Gyeonggi-do, Korea, Republic of|Pusan National University Yangsan Hospital, Gyeongsangnam-do, Korea, Republic of|Chonnam National University Hwasun Hospital, Jeollanam-do, Korea, Republic of|Seoul National University Hospital, Seoul, Korea, Republic of|Kangbuk Samsung Medical Center, Seoul, Korea, Republic of|Severance Hospital, Seoul, Korea, Republic of|Asan Medical Center, Seoul, Korea, Republic of|Samsung Medical Center, Seoul, Korea, Republic of|MEDSI Clinical Hospital on Pyatnitsky Highway; Department of antitumor drug therapy, Moscow, Moskovskaja Oblast, Russian Federation|SBIH ""Moscow Clinical Scientific and Practical Center named after A.S. Loginov of DHM"", Moskva, Moskovskaja Oblast, Russian Federation|TSBHI Altai Territorial oncological dispensary, Barnaul, Russian Federation|FSBSI ""Russian Oncological Scientific Center n.a. N.N. Blokhin"", Moscow, Russian Federation|Russian Scientific Center of Roentgenoradiology, Moscow, Russian Federation|Medical Center Avicenna; Urology, Novosibirsk, Russian Federation",,"https://ClinicalTrials.gov/show/NCT04338269"
8,"NCT03977571","Deferred Cytoreductive Nephrectomy in Synchronous Metastatic Renal Cell Carcinoma: The NORDIC-SUN-Trial","NORDIC-SUN","Not yet recruiting","No Results Available","Kidney Cancer|Renal Cell Carcinoma Metastatic|Synchronous Neoplasm","Procedure: Cytoreductive nephrectomy|Drug: Nivolumab|Drug: Ipilimumab|Other: Tissue sampling","Overall survival|Progression free survival|Time to subsequent systemic therapy|Objective response rate|Rate of patients meeting randomization criteria|Fractional percentage of tumor volume (ratio of primary tumor measurement to total sum of target lesions) to survival outcome in deferred cytoreductive nephrectomy patients and no surgery patients|Number of participants with treatment-related adverse events as by Common Terminology Criteria for Adverse Events version 5.0.|Number of participant with surgical morbidity assessed according to the Clavien-Dindo classification of surgical complications|Tumor infiltrating lymphocytes baseline and after surgery compared with OS, PFS, TST, ORR|Immune subsets in blood measured by flowcytometry in serial samples compared with OS, PFS, TST, ORR.|Genetic profile of circulation tumor DNA measured by Next generation sequencing (NGS), compared with OS, PFS, TST, ORR.|Genetic profile of primary tumor tissue measured by measured by NGS compared with OS, PFS, TST, ORR.|Profile of gut microbiome measured by NGS compared OS, PFS, TST, ORR.","Frede Donskov|Aarhus University Hospital|University of Aarhus","All","18 Years and older   (Adult, Older Adult)","Phase 3","400","Other","Interventional","Allocation: Randomized|Intervention Model: Parallel Assignment|Masking: None (Open Label)|Primary Purpose: Treatment","NORDIC-SUN|2019-001685-14","June 1, 2020","September 1, 2025","September 1, 2025","June 6, 2019",,"April 24, 2020","Aarhus University Hospital, Department of oncology, Aarhus, Central Region Of Denmark, Denmark|Department of Oncology, Herlev Hospital, Herlev, Denmark|Department of Oncology, Odense University Hospital, Odense, Denmark",,"https://ClinicalTrials.gov/show/NCT03977571"
9,"NCT03827044","Avelumab Plus 5-FU Based Chemotherapy as Adjuvant Treatment for Stage 3 MSI-High or POLE Mutant Colon Cancer","POLEM","Recruiting","No Results Available","POLE Exonuclease Mutant Colon Cancer|Microsatellite Instability|Stage III Colon Cancer","Drug: Avelumab","Primary End point: Disease Free survival|Secondary End Point: Overall Survival|Secondary End Points: Quality of Life|Secondary End Points: Toxicity of Investigational Medicinal Product according to the NCI-CTCAE (Common Terminology Criteria for Adverse Events) version 4.0.","Royal Marsden NHS Foundation Trust|University of Surrey|University of Oxford|Merck KGaA, Darmstadt, Germany","All","18 Years and older   (Adult, Older Adult)","Phase 3","402","Other|Industry","Interventional","Allocation: Randomized|Intervention Model: Parallel Assignment|Masking: None (Open Label)|Primary Purpose: Treatment","CCR 4673 POLEM","August 31, 2018","July 2024","July 2028","February 1, 2019",,"February 20, 2020","Royal Marsden NHS Foundation Trust, Sutton, Surrey, United Kingdom",,"https://ClinicalTrials.gov/show/NCT03827044"
10,"NCT04154956","SAR408701 Versus Docetaxel in Previously Treated, Carcinoembryonic Antigen-related Cell Adhesion Molecule 5 (CEACAM5) Positive Metastatic Non-squamous Non-small Cell Lung Cancer Patients","CARMEN-LC03","Recruiting","No Results Available","Non-small Cell Lung Cancer Metastatic","Drug: SAR408701|Drug: Docetaxel","Progression free survival (PFS)|Overall Survival (OS)|Objective response rate (ORR)|Health related quality of life (HRQOL) - disease related symptoms|Health related quality of life (HRQOL) - physical function|Health related quality of life (HRQOL) - role function|Number of participants with treatment emergent adverse events (TEAEs) and serious adverse events (SAEs)|Duration of response (DOR)","Sanofi","All","18 Years and older   (Adult, Older Adult)","Phase 3","554","Industry","Interventional","Allocation: Randomized|Intervention Model: Parallel Assignment|Masking: None (Open Label)|Primary Purpose: Treatment","EFC15858|2019-001273-81|U1111-1233-0781","February 6, 2020","April 2024","April 2024","November 7, 2019",,"June 1, 2020","Investigational Site Number 8400007, Bakersfield, California, United States|Investigational Site Number 8400004, Tinley Park, Illinois, United States|Investigational Site Number 8400003, Nashville, Tennessee, United States|Investigational Site Number 8400013, The Woodlands, Texas, United States|Investigational Site Number 0320004, Buenos Aires, Argentina|Investigational Site Number 0320009, Caba, Argentina|Investigational Site Number 0320005, Rosario, Argentina|Investigational Site Number 0320002, Salta, Argentina|Investigational Site Number 0360002, Blacktown, Australia|Investigational Site Number 0360003, Waratah, Australia|Investigational Site Number 0360001, Woolloongabba, Australia|Investigational Site Number 0560005, Brugge, Belgium|Investigational Site Number 0560002, Bruxelles, Belgium|Investigational Site Number 0560001, Leuven, Belgium|Investigational Site Number 0560003, Liège, Belgium|Investigational Site Number 1240003, Greenfield Park, Canada|Investigational Site Number 1240004, Montreal, Canada|Investigational Site Number 1520007, Santiago, Chile|Investigational Site Number 1520002, Santiago, Chile|Investigational Site Number 1520005, Temuco, Chile|Investigational Site Number 1520001, Viña Del Mar, Chile|Investigational Site Number 3480002, Budapest, Hungary|Investigational Site Number 3480003, Budapest, Hungary|Investigational Site Number 3480008, Farkasgyepü, Hungary|Investigational Site Number 3920011, Bunkyo-Ku, Japan|Investigational Site Number 3920012, Fukuoka-Shi, Japan|Investigational Site Number 3920017, Himeji-Shi, Japan|Investigational Site Number 3920001, Hirakata-Shi, Japan|Investigational Site Number 3920008, Kurume-Shi, Japan|Investigational Site Number 3920002, Nagoya-Shi, Japan|Investigational Site Number 3920015, Nagoya-Shi, Japan|Investigational Site Number 3920009, Natori-Shi, Japan|Investigational Site Number 3920013, Osaka Sayama-Shi, Japan|Investigational Site Number 3920003, Osaka-Shi, Japan|Investigational Site Number 3920014, Sakai-Shi, Japan|Investigational Site Number 3920016, Sapporo-Shi, Japan|Investigational Site Number 3920004, Sunto-Gun, Japan|Investigational Site Number 3920010, Ube-Shi, Japan|Investigational Site Number 3920007, Wakayama-Shi, Japan|Investigational Site Number 3920005, Yokohama-Shi, Japan|Investigational Site Number 4100006, Seoul, Korea, Republic of|Investigational Site Number 4100007, Seoul, Korea, Republic of|Investigational Site Number 4100003, Seoul, Korea, Republic of|Investigational Site Number 4100001, Seoul, Korea, Republic of|Investigational Site Number 4100004, Seoul, Korea, Republic of|Investigational Site Number 6160001, Warsaw, Poland|Investigational Site Number 6430001, Moscow, Russian Federation|Investigational Site Number 6430003, Saint -Petersburg, Russian Federation|Investigational Site Number 7920008, Adana, Turkey|Investigational Site Number 7920002, Adana, Turkey|Investigational Site Number 7920004, Ankara, Turkey|Investigational Site Number 7920003, Edirne, Turkey|Investigational Site Number 7920005, Istanbul, Turkey|Investigational Site Number 7920001, Istanbul, Turkey|Investigational Site Number 7920006, Istanbul, Turkey|Investigational Site Number 7920007, Izmir, Turkey|Investigational Site Number 7920009, Malatya, Turkey",,"https://ClinicalTrials.gov/show/NCT04154956"
11,"NCT04163237","Combined Immunotherapy and Targeted Therapy for Advanced Liver Cancer",,"Recruiting","No Results Available","Advanced Liver Cancer","Drug: PD-1|Drug: Sorafenib","Disease-free Survival|Overall Survival","Guangxi Medical University","All","Child, Adult, Older Adult","Phase 3","50","Other","Interventional","Allocation: Randomized|Intervention Model: Parallel Assignment|Masking: None (Open Label)|Primary Purpose: Treatment","GuangXiMU-HCC-PD1(2)","December 1, 2019","October 31, 2020","November 30, 2020","November 14, 2019",,"November 14, 2019","TaoBai, Nanning, Guangxi, China",,"https://ClinicalTrials.gov/show/NCT04163237"
12,"NCT03150875","A Study Comparing the Efficacy and Safety Between IBI308 and Docetaxel in Patients With Advanced or Metastatic NSCLC",,"Active, not recruiting","No Results Available","Non-small Cell Lung Cancer","Biological: IBI308|Drug: Docetaxel","OS (overall survival)|PFS (progression free survival)|ORR(objective response rate)|DOR(Duration of objective response)|DCR(Disease control rate)|AEs","Innovent Biologics (Suzhou) Co. Ltd.","All","18 Years to 75 Years   (Adult, Older Adult)","Phase 3","290","Industry","Interventional","Allocation: Randomized|Intervention Model: Parallel Assignment|Masking: None (Open Label)|Primary Purpose: Treatment","CIBI308C301","September 1, 2017","November 2, 2018","December 31, 2021","May 12, 2017",,"April 15, 2020","Zhejiang Cancer Hospital, Hangzhou, Zhejiang, China|The First Affiliated Hospital Zhejiang University, Hangzhou, Zhejiang, China",,"https://ClinicalTrials.gov/show/NCT03150875"
13,"NCT03598270","Platinum-based Chemotherapy With Atezolizumab and Niraparib in Patients With Recurrent Ovarian Cancer (ANITA)","ANITA","Recruiting","No Results Available","Recurrent Ovarian Carcinoma","Drug: Placebo|Drug: Carboplatin|Drug: Paclitaxel|Drug: Niraparib|Drug: Gemcitabine|Drug: Pegylated liposomal doxorubicin (PLD)|Drug: Atezolizumab","Progression-free survival (PFS)|Overall survival (OS)|Time to first subsequent therapy or death (TFST)|Time to second subsequent therapy or death (TSST)|Time to second progression or death (PFS2)|Incidence of Treatment Adverse Events|Patient-reported abdominal symptoms|Patient-reported outcomes (PROs) of function and health related quality of life (HRQoL)|Objective Response Rate (ORR)|Duration of response (DOR)|Progression-free survival (PFS) from the beginning of the maintenance phase in all patients, in patients in complete or partial response after completing chemotherapy and in patients with stable disease after completing chemotherapy|Progression Free Survival (PFS) and BRCA status|Overall Survival (OS) and BRCA status|Time to first subsequent therapy or death (TFST) and BRCA status|Objective Response Rate (ORR) and BRCA status|Duration of Response (DOR) and BRCA status|Characterize the pharmacokinetics (PK) of atezolizumab|Determine the incidence of anti-therapeutic antibody (ATAs)","Grupo Español de Investigación en Cáncer de Ovario|Hoffmann-La Roche|Tesaro, Inc.|AGO Study Group|Belgian Gynaecological Oncology Group|ARCAGY/ GINECO GROUP|The Israeli Society of Gynecologic Oncology|MaNGO","Female","18 Years and older   (Adult, Older Adult)","Phase 3","414","Other|Industry","Interventional","Allocation: Randomized|Intervention Model: Parallel Assignment|Masking: Triple (Participant, Care Provider, Investigator)|Primary Purpose: Treatment","ENGOT-Ov41/GEICO 69-O/ANITA|2018-000366-11|ENGOT-Ov41|GEICO 69-O","November 21, 2018","May 2023","November 2023","July 26, 2018",,"December 3, 2019","CHU St. Pierre, Brussels, Belgium|CHU UCL St. Luc, Brussels, Belgium|Grand Hôpital de Charleroi, Charleroi, Belgium|AZ Maria Middelares, Gent, Belgium|UZ Leuven, Leuven, Belgium|CHU de Liège, site Sart Tilman, Liège, Belgium|CHU Ambroise Paré, Mons, Belgium|CHU UCL Namur site St. Elisabeth, Namur, Belgium|Hochtaunus-Kliniken, Bad Homburg, Germany|Charité - Universitätsmedizin Berlin (CVK), Berlin, Germany|Universitätsklinikum Carl Gustav Carus Dresden, Dresden, Germany|Kliniken Essen-Mitte, Essen, Germany|Universitätsklinik Freiburg, Freiburg, Germany|Universitätsmedizin Greifswald, Greifswald, Germany|Mammazentrum Hamburg am Krankenhaus Jerusalem, Hamburg, Germany|Diakovere Krankenhaus, Hannover, Germany|Universitätsklinikum Schleswig-Holstein, Kiel, Germany|Klinikum Kulmbach, Kulmbach, Germany|Universitätsfrauenklinik Köln, Köln, Germany|Universitätsklinikum Schleswig-Holstein, Lübeck, Germany|Universitätsklinikum Münster, Münster, Germany|MVZ Nordhausen, Nordhausen, Germany|Klinikum Oldenburg AöR, Oldenburg, Germany|ROMed Klinikum Rosenheim, Rosenheim, Germany|Universitätsklinikum Tübingen, Tübingen, Germany|Universitätsfrauenklinik Ulm, Ulm, Germany|HELIOS Dr. Horst Schmidt Kliniken Wiesbaden, Wiesbaden, Germany|Spedali Civili, Brescia, Italy|Asst Lecco, Lecco, Italy|Istituto Europeo di Oncologia, Milano, Italy|I.R.C.C.S. Istituto Oncologico Veneto, Padova, Italy|Arcispedale Santa Maria Nuova, Reggio Emilia, Italy|AO Città della Salute e della Scienza- Ospedale Sant'Anna, Torino, Italy|Ospedale Mauriziano Umberto I, Torino, Italy|Hospital de Sabadell, Sabadell, Barcelona, Spain|Complejo Hospitalario Universitario de A Coruña, A Coruña, Spain|ICO Badalona, Badalona, Spain|H. Clínic Barcelona, Barcelona, Spain|Hospital de la Santa Creu i Sant Pau, Barcelona, Spain|Hospital de la Vall d'Hebron, Barcelona, Spain|H Reina Sofía Cordoba, Cordoba, Spain|ICO Girona, Girona, Spain|ICO Hospitalet, Hospitalet del Llobregat, Spain|Hospital de León, León, Spain|Clinica Universitaria de Navarra, Madrid, Spain|Hospital Clínico San Carlos, Madrid, Spain|Hospital Gregorio Marañon, Madrid, Spain|Hospital Universitario 12 de Octubre, Madrid, Spain|Hospital Universitario Fundación Jiménez Díaz, Madrid, Spain|Hospital Universitario La Paz, Madrid, Spain|Hospital Universitario Ramon y Cajal, Madrid, Spain|H Morales Meseguer, Murcia, Spain|Complejo Hospitalario Regional de Málaga, Málaga, Spain|Hospital Son Llatzer, Palma De Mallorca, Spain|Hospital Virgen del Rocio, Sevilla, Spain|H La Fe de Valencia, Valencia, Spain|Hospital Clínico Universitario de Valencia, Valencia, Spain|Hospital Universitario Miguel Servet, Zaragoza, Spain",,"https://ClinicalTrials.gov/show/NCT03598270"
14,"NCT03673735","Maintenance Immune Check-point Inhibitor Following Post-operative Chemo-radiation in Subjects With HPV-negative HNSCC","ADHERE","Not yet recruiting","No Results Available","Squamous Cell Head and Neck Carcinoma","Drug: Durvalumab|Radiation: radiotherapy|Drug: Placebo|Drug: Cisplatin","disease free survival|overall survival|Cumulative incidence of distant metastases|Cumulative incidence of loco-regional recurrence|Cumulative incidence of second cancers (all sites)|Rate of toxicity assessed by clinicians|Health-related quality of Life questionnaires: QLQ-C30","European Organisation for Research and Treatment of Cancer - EORTC","All","18 Years and older   (Adult, Older Adult)","Phase 3","650","Other","Interventional","Allocation: Randomized|Intervention Model: Parallel Assignment|Masking: Triple (Participant, Care Provider, Investigator)|Primary Purpose: Treatment","EORTC 1735-HNCG|2018-002730-21","March 2019","July 2026","December 2027","September 17, 2018",,"October 4, 2018",,,"https://ClinicalTrials.gov/show/NCT03673735"
15,"NCT03427827","Camrelizumab (PD-1 Antibody) After Chemoradiotherapy in Locoregionally Advanced Nasopharyngeal Carcinoma (PACIFIC-NPC)",,"Recruiting","No Results Available","Nasopharyngeal Neoplasms","Drug: Camrelizumab","disease-free survival|overall survival|distant metastasis-free survival|locoregional recurrence-free survival|adverse events (AEs) and severe adverse events (SAE)|quality of life (QoL)","Sun Yat-sen University","All","18 Years to 65 Years   (Adult, Older Adult)","Phase 3","400","Other","Interventional","Allocation: Randomized|Intervention Model: Parallel Assignment|Masking: None (Open Label)|Primary Purpose: Treatment","B2017-097-01","June 1, 2018","February 2022","February 2024","February 9, 2018",,"October 8, 2019","First People's Hospital of Foshan, Foshan, Guangdong, China|Guangzhou Medical University Cancer Hospital, Guangzhou, Guangdong, China|Panyu central hospital, Guangzhou, Guangdong, China|Sun Yat-sen University Cancer Center, Guangzhou, Guangdong, China|Cancer Hospital of Guangxi Medical University, Nanning, Guangxi, China|Cancer Hospital of Guizhou Medical University, Guiyang, Guizhou, China|Tongji Hospital Affiliated with Tongji Medical College of Huazhong University of Science and Technology, Wuhan, Hubei, China|Union Hospital Affiliated with Tongji Medical College of Huazhong University of Science and Technology, Wuhan, Hubei, China|Xiangya Hospital Central South University, Changsha, Hunan, China|Xijing Hospital, Fourth Military Medical University, Xi'an, Shanxi, China|West China Hospital, Sichuan University, Chengdu, Sichuan, China",,"https://ClinicalTrials.gov/show/NCT03427827"
